<?xml version="1.0"?>
<!DOCTYPE Report
[
<!ELEMENT Report (General ,(Doc|BPT)) >
<!ATTLIST Report ver CDATA #REQUIRED tmZone CDATA #REQUIRED>

<!ELEMENT General ( DocLocation ) >
<!ATTLIST General productName CDATA #REQUIRED productVer CDATA #REQUIRED os CDATA #REQUIRED host CDATA #REQUIRED qcserver CDATA #IMPLIED qcproject CDATA #IMPLIED SolManSolutionId CDATA #IMPLIED SolManProjectId CDATA #IMPLIED SolManTestPlanId CDATA #IMPLIED SolManTestPackageId CDATA #IMPLIED SolManUserInfoData CDATA #IMPLIED  >

<!ELEMENT BPT (DName,Res,DVer?,TSet?,TInst?,NodeArgs,AdditionalInfo*,Doc*) >
<!ATTLIST BPT rID ID #REQUIRED >

<!ELEMENT Doc (DName,ConfName?,Res,DVer?,TSet?,TInst?,RunType?,DT?,AdditionalInfo*,Step*,DIter*,Step*,Action*,Doc*,Summary?,TestMaintenanceSummary*,NodeArgs?) >
<!ATTLIST Doc rID ID #REQUIRED type (Test|BC|BPTWrapperTest|Flow|Group|Action) "Test" productName CDATA #REQUIRED BCIter CDATA #IMPLIED >

<!ELEMENT RunType ( #PCDATA )>
<!ATTLIST RunType fmStep (False|True) "False" batch (False|True) "False" upDesc (False|True) "False" upChk (False|True) "False" upAS (False|True) "False">

<!ELEMENT DName ( #PCDATA ) >

<!ELEMENT ConfName ( #PCDATA ) >

<!ELEMENT Res ( #PCDATA ) >

<!ELEMENT AdditionalInfo (AdditionalDataName,AdditionalDataValue ) >

<!ELEMENT AdditionalDataName ( #PCDATA ) >

<!ELEMENT AdditionalDataValue ( #PCDATA ) >

<!ELEMENT DVer ( #PCDATA ) >

<!ELEMENT TSet ( #PCDATA ) >

<!ELEMENT TInst ( #PCDATA ) >

<!ELEMENT DIter (Step*,Action+,Summary?,NodeArgs)>
<!ATTLIST DIter rID ID #REQUIRED iterID CDATA #REQUIRED>

<!ELEMENT DocLocation ( #PCDATA )>

<!ELEMENT Action (AName,AIter*,(Step|HtmlStep|Action)*, Summary,ActionMaintenanceSummary*, NodeArgs ) >
<!ATTLIST Action rID ID #REQUIRED>

<!ELEMENT AIter ((Step|HtmlStep|Action)*,DataMapping?, Summary?,NodeArgs) >
<!ATTLIST AIter rID ID #REQUIRED iterID CDATA #REQUIRED isCountable (False|True) "False" >

<!ELEMENT AName ( #PCDATA ) >

<!ELEMENT TestMaintenanceSummary (ActionMaintenanceSummary*) >
<!ATTLIST TestMaintenanceSummary ObjectsAdded CDATA #REQUIRED ObjectsUpdated CDATA #REQUIRED StepsUpdated CDATA #REQUIRED StepsComments CDATA #REQUIRED><!ELEMENT ActionMaintenanceSummary (ObjectChange* ) >
<!ATTLIST ActionMaintenanceSummary Action CDATA #REQUIRED Objects CDATA #REQUIRED Updated CDATA #REQUIRED LinesTotal CDATA #REQUIRED Added CDATA #REQUIRED LinesUpdated CDATA #REQUIRED>

<!ELEMENT ObjectChange  (Hierarchy, PropertyChangeList* ) >
<!ATTLIST ObjectChange Operation CDATA #IMPLIED OriginalRepository CDATA #IMPLIED>

<!ELEMENT PropertyChangeList (PropertyDef*) >

<!ELEMENT PropertyDef (OriginalValue, NewValue) >
<!ATTLIST PropertyDef PropName CDATA #REQUIRED OriginRegularExpression (True|False) "False" NewRegularExpression (True|False) "False" AddedProperty (True|False) "False" >

<!ELEMENT OriginalValue ( #PCDATA )>

<!ELEMENT NewValue ( #PCDATA )>

<!ELEMENT Hierarchy  (ObjectName, Hierarchy*) >
<!ATTLIST Hierarchy MicClass CDATA #REQUIRED>

<!ELEMENT ObjectName  ( #PCDATA ) >

<!ELEMENT Step (Obj,Details,Time,TimeTick* ,(Step|HtmlStep|Doc)*, DataMapping?, NodeArgs) >
<!ATTLIST Step rID ID #REQUIRED retval CDATA #IMPLIED>

<!ELEMENT HtmlStep (HTML,TimeTick*,(Step|HtmlStep|Doc)*,NodeArgs) >
<!ATTLIST HtmlStep rID ID #REQUIRED >

<!ELEMENT Obj ( #PCDATA ) >
<!ATTLIST Obj plainTxt (False|True) "True">

<!ELEMENT Details ( #PCDATA ) >
<!ATTLIST Details plainTxt (False|True) "True">

<!ELEMENT Time ( #PCDATA ) >

<!ELEMENT HTML ( #PCDATA ) >

<!ELEMENT Disp ( #PCDATA ) >

<!ELEMENT TimeTick ( #PCDATA ) >

<!ELEMENT DataMapping ( DataMappedItem* )>
<!ELEMENT DataMappedItem EMPTY >
<!ATTLIST DataMappedItem dsName CDATA #REQUIRED >
<!ATTLIST DataMappedItem rowId CDATA #REQUIRED >

<!ELEMENT NodeArgs (Disp,TopPane?,BtmPane?,ExtendedInfo? )>
<!ATTLIST NodeArgs eType CDATA #REQUIRED icon CDATA #REQUIRED nRep CDATA #REQUIRED UserNote CDATA #IMPLIED filter (False|True) "True">
<!ATTLIST NodeArgs status (Passed|Failed|Done|Warning|Information) "Done">
<!ATTLIST NodeArgs iconSel CDATA #IMPLIED nType CDATA #IMPLIED MovieMarker CDATA "">
<!ATTLIST NodeArgs Source CDATA #IMPLIED SourceLine CDATA #IMPLIED StepFlowItemKey CDATA #IMPLIED >

<!ELEMENT TopPane (Path)>

<!ELEMENT BtmPane ( (Path|WR)?,ASHilite?)>
<!ATTLIST BtmPane vType CDATA "HTML">

<!ELEMENT Path ( #PCDATA ) >

<!ELEMENT ASHilite ( #PCDATA ) >

<!ELEMENT WR ( #PCDATA ) >

<!ELEMENT ExtendedInfo ( StepData ) >

<!ATTLIST ExtendedInfo StepType CDATA #REQUIRED>
<!ELEMENT DT (NodeArgs) >
<!ATTLIST DT rID ID #REQUIRED>

<!ELEMENT Summary (Param*)>
<!ATTLIST Summary sTime CDATA #IMPLIED eTime CDATA #IMPLIED passed CDATA #IMPLIED failed CDATA #IMPLIED warnings CDATA #IMPLIED retval CDATA #IMPLIED stopped (False|True) "False" >

<!ELEMENT Param (ParamName,ParamVal)+ >
<!ATTLIST Param paramInOut (In|Out) "In">

<!ELEMENT ParamName ( #PCDATA ) >

<!ELEMENT ParamVal ( #PCDATA ) >

]
>
<Report ver="2.0" tmZone="Central Standard Time">
<General productName="Vugen" productVer="12" os="" host="LAPTOP-DD5IR7L1"><DocLocation><![CDATA[C:\Users\Naveen Reddy Vangala\Documents\VuGen\Scripts\sample 2]]></DocLocation></General>
<Doc rID="T1"   productName= "Vugen"  >
<DName><![CDATA[sample 2]]></DName>
<Res><![CDATA[result1]]></Res>
<Action rID="T2">
<AName><![CDATA[vuser_init]]></AName>
<Summary sTime="1/24/2017 - 19:45:32" eTime="1/24/2017 - 19:45:32" passed="0" failed="0" warnings="0" ></Summary>
<NodeArgs eType="StartAction" icon="2" nRep="5" >
<Disp><![CDATA[vuser_init Summary]]></Disp>
</NodeArgs>
</Action>
<DIter rID="T3" iterID="1" >
<Action rID="T4">
<AName><![CDATA[Action]]></AName>
<Step rID="T5">
<Obj plainTxt="False" ><![CDATA[Url: localhost:60680]]></Obj>
<Details plainTxt="False" ><![CDATA[<CENTER><STRONG><FONT COLOR=#009A63>Step completed successfully</FONT></STRONG></CENTER>]]></Details>
<Time><![CDATA[1/24/2017 - 19:45:35]]></Time>
<TimeTick>1485308735</TimeTick>
<NodeArgs eType="General" icon="4" nRep="9" status="Passed" >
<Disp><![CDATA[Url: localhost:60680]]></Disp>
<BtmPane vType="HTMLSNSH" >
<Path><![CDATA[\Iteration1\t1.inf]]></Path>
</BtmPane>
</NodeArgs>
</Step>
<Step rID="T6">
<Obj plainTxt="False" ><![CDATA[Service: Set Sockets Option]]></Obj>
<Details plainTxt="False" ><![CDATA[<CENTER>Set socket option <STRONG><FONT COLOR=#00AF00>SSL_VERSION</FONT></STRONG> with value <STRONG><FONT COLOR=#00AF00>2&3</FONT></STRONG></CENTER>]]></Details>
<Time><![CDATA[1/24/2017 - 19:45:35]]></Time>
<TimeTick>1485308735</TimeTick>
<NodeArgs eType="General" icon="5" nRep="10" >
<Disp><![CDATA[Service: Set Sockets Option]]></Disp>
</NodeArgs>
</Step>
<Step rID="T7">
<Obj plainTxt="False" ><![CDATA[Url: seed]]></Obj>
<Details plainTxt="False" ><![CDATA[<CENTER><STRONG><FONT COLOR=#009A63>Resource of content type ""DummyContentType"" loaded successfully</FONT></STRONG></CENTER>]]></Details>
<Time><![CDATA[1/24/2017 - 19:45:36]]></Time>
<TimeTick>1485308736</TimeTick>
<NodeArgs eType="General" icon="4" nRep="11" status="Passed" >
<Disp><![CDATA[Url: seed]]></Disp>
</NodeArgs>
</Step>
<Step rID="T8">
<Obj plainTxt="False" ><![CDATA[Service: Add Cookie]]></Obj>
<Details plainTxt="False" ><![CDATA[<CENTER>Add the following cookie: <STRONG><FONT COLOR=#00AF00>AMCV_9E1005A551ED61CA0A490D45%40AdobeOrg=-1176276602%7CMCAID%7C2C3BDD42051D383E-4000013480001994%7CMCIDTS%7C17179%7CMCMID%7C51456790579850249483626593230670422722%7CMCAAMLH-1484846344%7C9%7CMCAAMB-1484846344%7CNRX38WO0n5BH8Th-nqAG_A%7CMCOPTOUT-1484248744s%7CNONE; DOMAIN=sstats.adobe.com</FONT></STRONG></CENTER>]]></Details>
<Time><![CDATA[1/24/2017 - 19:45:36]]></Time>
<TimeTick>1485308736</TimeTick>
<NodeArgs eType="General" icon="6" nRep="12" >
<Disp><![CDATA[Service: Add Cookie]]></Disp>
</NodeArgs>
</Step>
<Step rID="T9">
<Obj plainTxt="False" ><![CDATA[Service: Add Cookie]]></Obj>
<Details plainTxt="False" ><![CDATA[<CENTER>Add the following cookie: <STRONG><FONT COLOR=#00AF00>s_pers=%20cpn%3D%7C1642007944553%3B%20ppn%3Dacrobat.adobe.com%253Alanding%253Aacrobat-pro-chrome-extension%7C1642007944555%3B%20s_nr%3D1484241544560-New%7C1515777544560%3B%20s_vs%3D1%7C1484243345110%3B; DOMAIN=sstats.adobe.com</FONT></STRONG></CENTER>]]></Details>
<Time><![CDATA[1/24/2017 - 19:45:36]]></Time>
<TimeTick>1485308736</TimeTick>
<NodeArgs eType="General" icon="6" nRep="13" >
<Disp><![CDATA[Service: Add Cookie]]></Disp>
</NodeArgs>
</Step>
<Step rID="T10">
<Obj plainTxt="False" ><![CDATA[Service: Add Cookie]]></Obj>
<Details plainTxt="False" ><![CDATA[<CENTER>Add the following cookie: <STRONG><FONT COLOR=#00AF00>mbox=session#0aabdf8e2e0b44858558600e194399c2#1484243406|PC#0aabdf8e2e0b44858558600e194399c2.28_73#1547486346; DOMAIN=sstats.adobe.com</FONT></STRONG></CENTER>]]></Details>
<Time><![CDATA[1/24/2017 - 19:45:36]]></Time>
<TimeTick>1485308736</TimeTick>
<NodeArgs eType="General" icon="6" nRep="14" >
<Disp><![CDATA[Service: Add Cookie]]></Disp>
</NodeArgs>
</Step>
<Step rID="T11">
<Obj plainTxt="False" ><![CDATA[Service: Add Cookie]]></Obj>
<Details plainTxt="False" ><![CDATA[<CENTER>Add the following cookie: <STRONG><FONT COLOR=#00AF00>s_vi=[CS]v1|2C3BDD42051D383E-4000013480001994[CE]; DOMAIN=sstats.adobe.com</FONT></STRONG></CENTER>]]></Details>
<Time><![CDATA[1/24/2017 - 19:45:36]]></Time>
<TimeTick>1485308736</TimeTick>
<NodeArgs eType="General" icon="6" nRep="15" >
<Disp><![CDATA[Service: Add Cookie]]></Disp>
</NodeArgs>
</Step>
<Step rID="T12">
<Obj plainTxt="False" ><![CDATA[Custom Request: returnCookies]]></Obj>
<Details plainTxt="False" ><![CDATA[<CENTER><STRONG><FONT COLOR=#009A63>Resource of content type ""DummyContentType"" loaded successfully</FONT></STRONG></CENTER>]]></Details>
<Time><![CDATA[1/24/2017 - 19:45:36]]></Time>
<TimeTick>1485308736</TimeTick>
<NodeArgs eType="General" icon="7" nRep="16" status="Passed" >
<Disp><![CDATA[Custom Request: returnCookies]]></Disp>
</NodeArgs>
</Step>
<Step rID="T13">
<Obj plainTxt="False" ><![CDATA[Custom Request: query]]></Obj>
<Details plainTxt="False" ><![CDATA[<CENTER><STRONG><FONT COLOR=#009A63>Resource of content type ""DummyContentType"" loaded successfully</FONT></STRONG></CENTER>]]></Details>
<Time><![CDATA[1/24/2017 - 19:45:37]]></Time>
<TimeTick>1485308737</TimeTick>
<NodeArgs eType="General" icon="7" nRep="17" status="Passed" >
<Disp><![CDATA[Custom Request: query]]></Disp>
</NodeArgs>
</Step>
<Step rID="T14">
<Obj plainTxt="False" ><![CDATA[Service: WebSocket Connection]]></Obj>
<Details plainTxt="False" ><![CDATA[<CENTER><STRONG><FONT COLOR=#009A63>Resource loaded successfully</FONT></STRONG></CENTER>]]></Details>
<Time><![CDATA[1/24/2017 - 19:45:37]]></Time>
<TimeTick>1485308737</TimeTick>
<NodeArgs eType="General" icon="5" nRep="18" status="Passed" >
<Disp><![CDATA[Service: WebSocket Connection]]></Disp>
</NodeArgs>
</Step>
<Step rID="T15">
<Obj plainTxt="False" ><![CDATA[Service: WebSocket Send]]></Obj>
<Details plainTxt="False" ><![CDATA[<CENTER><FONT COLOR=#FF0031>Step creation failed</CENTER>]]></Details>
<Time><![CDATA[1/24/2017 - 19:45:37]]></Time>
<TimeTick>1485308737</TimeTick>
<NodeArgs eType="General" icon="5" nRep="19" status="Passed" >
<Disp><![CDATA[Service: WebSocket Send]]></Disp>
</NodeArgs>
</Step>
<Step rID="T16">
<Obj plainTxt="False" ><![CDATA[Service: WebSocket Send]]></Obj>
<Details plainTxt="False" ><![CDATA[<CENTER><FONT COLOR=#FF0031>Step creation failed</CENTER>]]></Details>
<Time><![CDATA[1/24/2017 - 19:45:37]]></Time>
<TimeTick>1485308737</TimeTick>
<NodeArgs eType="General" icon="5" nRep="20" status="Passed" >
<Disp><![CDATA[Service: WebSocket Send]]></Disp>
</NodeArgs>
</Step>
<Step rID="T17">
<Obj plainTxt="False" ><![CDATA[Service: WebSocket Send]]></Obj>
<Details plainTxt="False" ><![CDATA[<CENTER><FONT COLOR=#FF0031>Step creation failed</CENTER>]]></Details>
<Time><![CDATA[1/24/2017 - 19:45:37]]></Time>
<TimeTick>1485308737</TimeTick>
<NodeArgs eType="General" icon="5" nRep="21" status="Passed" >
<Disp><![CDATA[Service: WebSocket Send]]></Disp>
</NodeArgs>
</Step>
<Step rID="T18">
<Obj plainTxt="False" ><![CDATA[Service: WebSocket Send]]></Obj>
<Details plainTxt="False" ><![CDATA[<CENTER><FONT COLOR=#FF0031>Step creation failed</CENTER>]]></Details>
<Time><![CDATA[1/24/2017 - 19:45:37]]></Time>
<TimeTick>1485308737</TimeTick>
<NodeArgs eType="General" icon="5" nRep="22" status="Passed" >
<Disp><![CDATA[Service: WebSocket Send]]></Disp>
</NodeArgs>
</Step>
<Step rID="T19">
<Obj plainTxt="False" ><![CDATA[Service: WebSocket Send]]></Obj>
<Details plainTxt="False" ><![CDATA[<CENTER><FONT COLOR=#FF0031>Step creation failed</CENTER>]]></Details>
<Time><![CDATA[1/24/2017 - 19:45:37]]></Time>
<TimeTick>1485308737</TimeTick>
<NodeArgs eType="General" icon="5" nRep="23" status="Passed" >
<Disp><![CDATA[Service: WebSocket Send]]></Disp>
</NodeArgs>
</Step>
<Step rID="T20">
<Obj plainTxt="False" ><![CDATA[Service: WebSocket Send]]></Obj>
<Details plainTxt="False" ><![CDATA[<CENTER><FONT COLOR=#FF0031>Step creation failed</CENTER>]]></Details>
<Time><![CDATA[1/24/2017 - 19:45:37]]></Time>
<TimeTick>1485308737</TimeTick>
<NodeArgs eType="General" icon="5" nRep="24" status="Passed" >
<Disp><![CDATA[Service: WebSocket Send]]></Disp>
</NodeArgs>
</Step>
<Step rID="T21">
<Obj plainTxt="False" ><![CDATA[Service: WebSocket Send]]></Obj>
<Details plainTxt="False" ><![CDATA[<CENTER><FONT COLOR=#FF0031>Step creation failed</CENTER>]]></Details>
<Time><![CDATA[1/24/2017 - 19:45:37]]></Time>
<TimeTick>1485308737</TimeTick>
<NodeArgs eType="General" icon="5" nRep="25" status="Passed" >
<Disp><![CDATA[Service: WebSocket Send]]></Disp>
</NodeArgs>
</Step>
<Step rID="T22">
<Obj plainTxt="False" ><![CDATA[Service: WebSocket Send]]></Obj>
<Details plainTxt="False" ><![CDATA[<CENTER><FONT COLOR=#FF0031>Step creation failed</CENTER>]]></Details>
<Time><![CDATA[1/24/2017 - 19:45:37]]></Time>
<TimeTick>1485308737</TimeTick>
<NodeArgs eType="General" icon="5" nRep="26" status="Passed" >
<Disp><![CDATA[Service: WebSocket Send]]></Disp>
</NodeArgs>
</Step>
<Step rID="T23">
<Obj plainTxt="False" ><![CDATA[Service: WebSocket Send]]></Obj>
<Details plainTxt="False" ><![CDATA[<CENTER><FONT COLOR=#FF0031>Step creation failed</CENTER>]]></Details>
<Time><![CDATA[1/24/2017 - 19:45:37]]></Time>
<TimeTick>1485308737</TimeTick>
<NodeArgs eType="General" icon="5" nRep="27" status="Passed" >
<Disp><![CDATA[Service: WebSocket Send]]></Disp>
</NodeArgs>
</Step>
<Step rID="T24">
<Obj plainTxt="False" ><![CDATA[Service: WebSocket Send]]></Obj>
<Details plainTxt="False" ><![CDATA[<CENTER><FONT COLOR=#FF0031>Step creation failed</CENTER>]]></Details>
<Time><![CDATA[1/24/2017 - 19:45:37]]></Time>
<TimeTick>1485308737</TimeTick>
<NodeArgs eType="General" icon="5" nRep="28" status="Passed" >
<Disp><![CDATA[Service: WebSocket Send]]></Disp>
</NodeArgs>
</Step>
<Step rID="T25">
<Obj plainTxt="False" ><![CDATA[Service: WebSocket Send]]></Obj>
<Details plainTxt="False" ><![CDATA[<CENTER><FONT COLOR=#FF0031>Step creation failed</CENTER>]]></Details>
<Time><![CDATA[1/24/2017 - 19:45:37]]></Time>
<TimeTick>1485308737</TimeTick>
<NodeArgs eType="General" icon="5" nRep="29" status="Passed" >
<Disp><![CDATA[Service: WebSocket Send]]></Disp>
</NodeArgs>
</Step>
<Step rID="T26">
<Obj plainTxt="False" ><![CDATA[Service: WebSocket Send]]></Obj>
<Details plainTxt="False" ><![CDATA[<CENTER><FONT COLOR=#FF0031>Step creation failed</CENTER>]]></Details>
<Time><![CDATA[1/24/2017 - 19:45:37]]></Time>
<TimeTick>1485308737</TimeTick>
<NodeArgs eType="General" icon="5" nRep="30" status="Passed" >
<Disp><![CDATA[Service: WebSocket Send]]></Disp>
</NodeArgs>
</Step>
<Step rID="T27">
<Obj plainTxt="False" ><![CDATA[Service: WebSocket Send]]></Obj>
<Details plainTxt="False" ><![CDATA[<CENTER><FONT COLOR=#FF0031>Step creation failed</CENTER>]]></Details>
<Time><![CDATA[1/24/2017 - 19:45:37]]></Time>
<TimeTick>1485308737</TimeTick>
<NodeArgs eType="General" icon="5" nRep="31" status="Passed" >
<Disp><![CDATA[Service: WebSocket Send]]></Disp>
</NodeArgs>
</Step>
<Step rID="T28">
<Obj plainTxt="False" ><![CDATA[Service: WebSocket Send]]></Obj>
<Details plainTxt="False" ><![CDATA[<CENTER><FONT COLOR=#FF0031>Step creation failed</CENTER>]]></Details>
<Time><![CDATA[1/24/2017 - 19:45:37]]></Time>
<TimeTick>1485308737</TimeTick>
<NodeArgs eType="General" icon="5" nRep="32" status="Passed" >
<Disp><![CDATA[Service: WebSocket Send]]></Disp>
</NodeArgs>
</Step>
<Step rID="T29">
<Obj plainTxt="False" ><![CDATA[Service: WebSocket Send]]></Obj>
<Details plainTxt="False" ><![CDATA[<CENTER><FONT COLOR=#FF0031>Step creation failed</CENTER>]]></Details>
<Time><![CDATA[1/24/2017 - 19:45:37]]></Time>
<TimeTick>1485308737</TimeTick>
<NodeArgs eType="General" icon="5" nRep="33" status="Passed" >
<Disp><![CDATA[Service: WebSocket Send]]></Disp>
</NodeArgs>
</Step>
<Step rID="T30">
<Obj plainTxt="False" ><![CDATA[Service: WebSocket Send]]></Obj>
<Details plainTxt="False" ><![CDATA[<CENTER><FONT COLOR=#FF0031>Step creation failed</CENTER>]]></Details>
<Time><![CDATA[1/24/2017 - 19:45:37]]></Time>
<TimeTick>1485308737</TimeTick>
<NodeArgs eType="General" icon="5" nRep="34" status="Passed" >
<Disp><![CDATA[Service: WebSocket Send]]></Disp>
</NodeArgs>
</Step>
<Step rID="T31">
<Obj plainTxt="False" ><![CDATA[Service: WebSocket Send]]></Obj>
<Details plainTxt="False" ><![CDATA[<CENTER><FONT COLOR=#FF0031>Step creation failed</CENTER>]]></Details>
<Time><![CDATA[1/24/2017 - 19:45:37]]></Time>
<TimeTick>1485308737</TimeTick>
<NodeArgs eType="General" icon="5" nRep="35" status="Passed" >
<Disp><![CDATA[Service: WebSocket Send]]></Disp>
</NodeArgs>
</Step>
<Step rID="T32">
<Obj plainTxt="False" ><![CDATA[Service: WebSocket Send]]></Obj>
<Details plainTxt="False" ><![CDATA[<CENTER><FONT COLOR=#FF0031>Step creation failed</CENTER>]]></Details>
<Time><![CDATA[1/24/2017 - 19:45:37]]></Time>
<TimeTick>1485308737</TimeTick>
<NodeArgs eType="General" icon="5" nRep="36" status="Passed" >
<Disp><![CDATA[Service: WebSocket Send]]></Disp>
</NodeArgs>
</Step>
<Step rID="T33">
<Obj plainTxt="False" ><![CDATA[Service: WebSocket Send]]></Obj>
<Details plainTxt="False" ><![CDATA[<CENTER><FONT COLOR=#FF0031>Step creation failed</CENTER>]]></Details>
<Time><![CDATA[1/24/2017 - 19:45:37]]></Time>
<TimeTick>1485308737</TimeTick>
<NodeArgs eType="General" icon="5" nRep="37" status="Passed" >
<Disp><![CDATA[Service: WebSocket Send]]></Disp>
</NodeArgs>
</Step>
<Step rID="T34">
<Obj plainTxt="False" ><![CDATA[Service: WebSocket Send]]></Obj>
<Details plainTxt="False" ><![CDATA[<CENTER><FONT COLOR=#FF0031>Step creation failed</CENTER>]]></Details>
<Time><![CDATA[1/24/2017 - 19:45:37]]></Time>
<TimeTick>1485308737</TimeTick>
<NodeArgs eType="General" icon="5" nRep="38" status="Passed" >
<Disp><![CDATA[Service: WebSocket Send]]></Disp>
</NodeArgs>
</Step>
<Step rID="T35">
<Obj plainTxt="False" ><![CDATA[Service: WebSocket Send]]></Obj>
<Details plainTxt="False" ><![CDATA[<CENTER><FONT COLOR=#FF0031>Step creation failed</CENTER>]]></Details>
<Time><![CDATA[1/24/2017 - 19:45:37]]></Time>
<TimeTick>1485308737</TimeTick>
<NodeArgs eType="General" icon="5" nRep="39" status="Passed" >
<Disp><![CDATA[Service: WebSocket Send]]></Disp>
</NodeArgs>
</Step>
<Step rID="T36">
<Obj plainTxt="False" ><![CDATA[Service: WebSocket Send]]></Obj>
<Details plainTxt="False" ><![CDATA[<CENTER><FONT COLOR=#FF0031>Step creation failed</CENTER>]]></Details>
<Time><![CDATA[1/24/2017 - 19:45:37]]></Time>
<TimeTick>1485308737</TimeTick>
<NodeArgs eType="General" icon="5" nRep="40" status="Passed" >
<Disp><![CDATA[Service: WebSocket Send]]></Disp>
</NodeArgs>
</Step>
<Step rID="T37">
<Obj plainTxt="False" ><![CDATA[Service: WebSocket Send]]></Obj>
<Details plainTxt="False" ><![CDATA[<CENTER><FONT COLOR=#FF0031>Step creation failed</CENTER>]]></Details>
<Time><![CDATA[1/24/2017 - 19:45:37]]></Time>
<TimeTick>1485308737</TimeTick>
<NodeArgs eType="General" icon="5" nRep="41" status="Passed" >
<Disp><![CDATA[Service: WebSocket Send]]></Disp>
</NodeArgs>
</Step>
<Step rID="T38">
<Obj plainTxt="False" ><![CDATA[Service: WebSocket Send]]></Obj>
<Details plainTxt="False" ><![CDATA[<CENTER><FONT COLOR=#FF0031>Step creation failed</CENTER>]]></Details>
<Time><![CDATA[1/24/2017 - 19:45:37]]></Time>
<TimeTick>1485308737</TimeTick>
<NodeArgs eType="General" icon="5" nRep="42" status="Passed" >
<Disp><![CDATA[Service: WebSocket Send]]></Disp>
</NodeArgs>
</Step>
<Step rID="T39">
<Obj plainTxt="False" ><![CDATA[Service: WebSocket Send]]></Obj>
<Details plainTxt="False" ><![CDATA[<CENTER><FONT COLOR=#FF0031>Step creation failed</CENTER>]]></Details>
<Time><![CDATA[1/24/2017 - 19:45:37]]></Time>
<TimeTick>1485308737</TimeTick>
<NodeArgs eType="General" icon="5" nRep="43" status="Passed" >
<Disp><![CDATA[Service: WebSocket Send]]></Disp>
</NodeArgs>
</Step>
<Step rID="T40">
<Obj plainTxt="False" ><![CDATA[Service: WebSocket Send]]></Obj>
<Details plainTxt="False" ><![CDATA[<CENTER><FONT COLOR=#FF0031>Step creation failed</CENTER>]]></Details>
<Time><![CDATA[1/24/2017 - 19:45:37]]></Time>
<TimeTick>1485308737</TimeTick>
<NodeArgs eType="General" icon="5" nRep="44" status="Passed" >
<Disp><![CDATA[Service: WebSocket Send]]></Disp>
</NodeArgs>
</Step>
<Step rID="T41">
<Obj plainTxt="False" ><![CDATA[Service: WebSocket Send]]></Obj>
<Details plainTxt="False" ><![CDATA[<CENTER><FONT COLOR=#FF0031>Step creation failed</CENTER>]]></Details>
<Time><![CDATA[1/24/2017 - 19:45:37]]></Time>
<TimeTick>1485308737</TimeTick>
<NodeArgs eType="General" icon="5" nRep="45" status="Passed" >
<Disp><![CDATA[Service: WebSocket Send]]></Disp>
</NodeArgs>
</Step>
<Step rID="T42">
<Obj plainTxt="False" ><![CDATA[Service: WebSocket Send]]></Obj>
<Details plainTxt="False" ><![CDATA[<CENTER><FONT COLOR=#FF0031>Step creation failed</CENTER>]]></Details>
<Time><![CDATA[1/24/2017 - 19:45:37]]></Time>
<TimeTick>1485308737</TimeTick>
<NodeArgs eType="General" icon="5" nRep="46" status="Passed" >
<Disp><![CDATA[Service: WebSocket Send]]></Disp>
</NodeArgs>
</Step>
<Step rID="T43">
<Obj plainTxt="False" ><![CDATA[Service: WebSocket Send]]></Obj>
<Details plainTxt="False" ><![CDATA[<CENTER><FONT COLOR=#FF0031>Step creation failed</CENTER>]]></Details>
<Time><![CDATA[1/24/2017 - 19:45:37]]></Time>
<TimeTick>1485308737</TimeTick>
<NodeArgs eType="General" icon="5" nRep="47" status="Passed" >
<Disp><![CDATA[Service: WebSocket Send]]></Disp>
</NodeArgs>
</Step>
<Step rID="T44">
<Obj plainTxt="False" ><![CDATA[Service: WebSocket Send]]></Obj>
<Details plainTxt="False" ><![CDATA[<CENTER><FONT COLOR=#FF0031>Step creation failed</CENTER>]]></Details>
<Time><![CDATA[1/24/2017 - 19:45:37]]></Time>
<TimeTick>1485308737</TimeTick>
<NodeArgs eType="General" icon="5" nRep="48" status="Passed" >
<Disp><![CDATA[Service: WebSocket Send]]></Disp>
</NodeArgs>
</Step>
<Step rID="T45">
<Obj plainTxt="False" ><![CDATA[Service: WebSocket Send]]></Obj>
<Details plainTxt="False" ><![CDATA[<CENTER><FONT COLOR=#FF0031>Step creation failed</CENTER>]]></Details>
<Time><![CDATA[1/24/2017 - 19:45:37]]></Time>
<TimeTick>1485308737</TimeTick>
<NodeArgs eType="General" icon="5" nRep="49" status="Passed" >
<Disp><![CDATA[Service: WebSocket Send]]></Disp>
</NodeArgs>
</Step>
<Step rID="T46">
<Obj plainTxt="False" ><![CDATA[Service: WebSocket Send]]></Obj>
<Details plainTxt="False" ><![CDATA[<CENTER><FONT COLOR=#FF0031>Step creation failed</CENTER>]]></Details>
<Time><![CDATA[1/24/2017 - 19:45:37]]></Time>
<TimeTick>1485308737</TimeTick>
<NodeArgs eType="General" icon="5" nRep="50" status="Passed" >
<Disp><![CDATA[Service: WebSocket Send]]></Disp>
</NodeArgs>
</Step>
<Step rID="T47">
<Obj plainTxt="False" ><![CDATA[Service: WebSocket Send]]></Obj>
<Details plainTxt="False" ><![CDATA[<CENTER><FONT COLOR=#FF0031>Step creation failed</CENTER>]]></Details>
<Time><![CDATA[1/24/2017 - 19:45:37]]></Time>
<TimeTick>1485308737</TimeTick>
<NodeArgs eType="General" icon="5" nRep="51" status="Passed" >
<Disp><![CDATA[Service: WebSocket Send]]></Disp>
</NodeArgs>
</Step>
<Step rID="T48">
<Obj plainTxt="False" ><![CDATA[Service: WebSocket Send]]></Obj>
<Details plainTxt="False" ><![CDATA[<CENTER><FONT COLOR=#FF0031>Step creation failed</CENTER>]]></Details>
<Time><![CDATA[1/24/2017 - 19:45:37]]></Time>
<TimeTick>1485308737</TimeTick>
<NodeArgs eType="General" icon="5" nRep="52" status="Passed" >
<Disp><![CDATA[Service: WebSocket Send]]></Disp>
</NodeArgs>
</Step>
<Step rID="T49">
<Obj plainTxt="False" ><![CDATA[Service: WebSocket Send]]></Obj>
<Details plainTxt="False" ><![CDATA[<CENTER><FONT COLOR=#FF0031>Step creation failed</CENTER>]]></Details>
<Time><![CDATA[1/24/2017 - 19:45:37]]></Time>
<TimeTick>1485308737</TimeTick>
<NodeArgs eType="General" icon="5" nRep="53" status="Passed" >
<Disp><![CDATA[Service: WebSocket Send]]></Disp>
</NodeArgs>
</Step>
<Step rID="T50">
<Obj plainTxt="False" ><![CDATA[Service: WebSocket Send]]></Obj>
<Details plainTxt="False" ><![CDATA[<CENTER><FONT COLOR=#FF0031>Step creation failed</CENTER>]]></Details>
<Time><![CDATA[1/24/2017 - 19:45:37]]></Time>
<TimeTick>1485308737</TimeTick>
<NodeArgs eType="General" icon="5" nRep="54" status="Passed" >
<Disp><![CDATA[Service: WebSocket Send]]></Disp>
</NodeArgs>
</Step>
<Step rID="T51">
<Obj plainTxt="False" ><![CDATA[Service: WebSocket Send]]></Obj>
<Details plainTxt="False" ><![CDATA[<CENTER><FONT COLOR=#FF0031>Step creation failed</CENTER>]]></Details>
<Time><![CDATA[1/24/2017 - 19:45:37]]></Time>
<TimeTick>1485308737</TimeTick>
<NodeArgs eType="General" icon="5" nRep="55" status="Passed" >
<Disp><![CDATA[Service: WebSocket Send]]></Disp>
</NodeArgs>
</Step>
<Step rID="T52">
<Obj plainTxt="False" ><![CDATA[Service: WebSocket Send]]></Obj>
<Details plainTxt="False" ><![CDATA[<CENTER><FONT COLOR=#FF0031>Step creation failed</CENTER>]]></Details>
<Time><![CDATA[1/24/2017 - 19:45:37]]></Time>
<TimeTick>1485308737</TimeTick>
<NodeArgs eType="General" icon="5" nRep="56" status="Passed" >
<Disp><![CDATA[Service: WebSocket Send]]></Disp>
</NodeArgs>
</Step>
<Step rID="T53">
<Obj plainTxt="False" ><![CDATA[Service: WebSocket Send]]></Obj>
<Details plainTxt="False" ><![CDATA[<CENTER><FONT COLOR=#FF0031>Step creation failed</CENTER>]]></Details>
<Time><![CDATA[1/24/2017 - 19:45:37]]></Time>
<TimeTick>1485308737</TimeTick>
<NodeArgs eType="General" icon="5" nRep="57" status="Passed" >
<Disp><![CDATA[Service: WebSocket Send]]></Disp>
</NodeArgs>
</Step>
<Step rID="T54">
<Obj plainTxt="False" ><![CDATA[Service: WebSocket Send]]></Obj>
<Details plainTxt="False" ><![CDATA[<CENTER><FONT COLOR=#FF0031>Step creation failed</CENTER>]]></Details>
<Time><![CDATA[1/24/2017 - 19:45:37]]></Time>
<TimeTick>1485308737</TimeTick>
<NodeArgs eType="General" icon="5" nRep="58" status="Passed" >
<Disp><![CDATA[Service: WebSocket Send]]></Disp>
</NodeArgs>
</Step>
<Step rID="T55">
<Obj plainTxt="False" ><![CDATA[Service: WebSocket Send]]></Obj>
<Details plainTxt="False" ><![CDATA[<CENTER><FONT COLOR=#FF0031>Step creation failed</CENTER>]]></Details>
<Time><![CDATA[1/24/2017 - 19:45:37]]></Time>
<TimeTick>1485308737</TimeTick>
<NodeArgs eType="General" icon="5" nRep="59" status="Passed" >
<Disp><![CDATA[Service: WebSocket Send]]></Disp>
</NodeArgs>
</Step>
<Step rID="T56">
<Obj plainTxt="False" ><![CDATA[Service: WebSocket Send]]></Obj>
<Details plainTxt="False" ><![CDATA[<CENTER><FONT COLOR=#FF0031>Step creation failed</CENTER>]]></Details>
<Time><![CDATA[1/24/2017 - 19:45:37]]></Time>
<TimeTick>1485308737</TimeTick>
<NodeArgs eType="General" icon="5" nRep="60" status="Passed" >
<Disp><![CDATA[Service: WebSocket Send]]></Disp>
</NodeArgs>
</Step>
<Step rID="T57">
<Obj plainTxt="False" ><![CDATA[Service: WebSocket Send]]></Obj>
<Details plainTxt="False" ><![CDATA[<CENTER><FONT COLOR=#FF0031>Step creation failed</CENTER>]]></Details>
<Time><![CDATA[1/24/2017 - 19:45:37]]></Time>
<TimeTick>1485308737</TimeTick>
<NodeArgs eType="General" icon="5" nRep="61" status="Passed" >
<Disp><![CDATA[Service: WebSocket Send]]></Disp>
</NodeArgs>
</Step>
<Step rID="T58">
<Obj plainTxt="False" ><![CDATA[Service: WebSocket Send]]></Obj>
<Details plainTxt="False" ><![CDATA[<CENTER><FONT COLOR=#FF0031>Step creation failed</CENTER>]]></Details>
<Time><![CDATA[1/24/2017 - 19:45:37]]></Time>
<TimeTick>1485308737</TimeTick>
<NodeArgs eType="General" icon="5" nRep="62" status="Passed" >
<Disp><![CDATA[Service: WebSocket Send]]></Disp>
</NodeArgs>
</Step>
<Step rID="T59">
<Obj plainTxt="False" ><![CDATA[Service: WebSocket Send]]></Obj>
<Details plainTxt="False" ><![CDATA[<CENTER><FONT COLOR=#FF0031>Step creation failed</CENTER>]]></Details>
<Time><![CDATA[1/24/2017 - 19:45:37]]></Time>
<TimeTick>1485308737</TimeTick>
<NodeArgs eType="General" icon="5" nRep="63" status="Passed" >
<Disp><![CDATA[Service: WebSocket Send]]></Disp>
</NodeArgs>
</Step>
<Step rID="T60">
<Obj plainTxt="False" ><![CDATA[Service: WebSocket Send]]></Obj>
<Details plainTxt="False" ><![CDATA[<CENTER><FONT COLOR=#FF0031>Step creation failed</CENTER>]]></Details>
<Time><![CDATA[1/24/2017 - 19:45:37]]></Time>
<TimeTick>1485308737</TimeTick>
<NodeArgs eType="General" icon="5" nRep="64" status="Passed" >
<Disp><![CDATA[Service: WebSocket Send]]></Disp>
</NodeArgs>
</Step>
<Step rID="T61">
<Obj plainTxt="False" ><![CDATA[Service: WebSocket Send]]></Obj>
<Details plainTxt="False" ><![CDATA[<CENTER><FONT COLOR=#FF0031>Step creation failed</CENTER>]]></Details>
<Time><![CDATA[1/24/2017 - 19:45:37]]></Time>
<TimeTick>1485308737</TimeTick>
<NodeArgs eType="General" icon="5" nRep="65" status="Passed" >
<Disp><![CDATA[Service: WebSocket Send]]></Disp>
</NodeArgs>
</Step>
<Step rID="T62">
<Obj plainTxt="False" ><![CDATA[Service: WebSocket Send]]></Obj>
<Details plainTxt="False" ><![CDATA[<CENTER><FONT COLOR=#FF0031>Step creation failed</CENTER>]]></Details>
<Time><![CDATA[1/24/2017 - 19:45:37]]></Time>
<TimeTick>1485308737</TimeTick>
<NodeArgs eType="General" icon="5" nRep="66" status="Passed" >
<Disp><![CDATA[Service: WebSocket Send]]></Disp>
</NodeArgs>
</Step>
<Step rID="T63">
<Obj plainTxt="False" ><![CDATA[Service: WebSocket Send]]></Obj>